{
  "id": "c4-duplicate-response-name-fragments",
  "source": "precision",
  "sdl": "directive @cost(weight: String!) on ARGUMENT_DEFINITION | ENUM | FIELD_DEFINITION | INPUT_FIELD_DEFINITION | OBJECT | SCALAR\ndirective @listSize(assumedSize: Int, slicingArguments: [String!], sizedFields: [String!], requireOneSlicingArgument: Boolean = true) on FIELD_DEFINITION\n\nunion Result = A\n\ntype A {\n  a: Int @cost(weight: \"10\")\n}\n\ntype Query {\n  result: Result\n}\n",
  "operation": "query {\n  result {\n    ...First\n    ...Second\n  }\n}\n\nfragment First on A {\n  label: a\n}\n\nfragment Second on A {\n  label: a\n}\n",
  "operationName": null,
  "variables": null,
  "defaultListSize": "Infinity",
  "backend": "exact-case",
  "expected": {
    "typeCost": 2,
    "fieldCost": 11
  },
  "notes": "Same case as c4-duplicate-response-name, spelled with named fragments instead of inline fragments. Same schema and expected numbers; fragment spelling must not change the collected cost."
}
